<?xml version="1.0" encoding="UTF-8" standalone="no"?>
<!DOCTYPE pelicula SYSTEM "pelicula.dtd">
<pelicula id="1" categoria="sci-fi">
    <titulo>La guerra de las galaxias</titulo>
    <fecha>22/07/1977</fecha>
    <actores>
        <actor>
            <nombre>Luke</nombre>
            <edad>29</edad>
        </actor>
        <actor>
            <nombre>Han solo</nombre>
            <edad>39</edad>
        </actor>
    </actores>
    <director>pepe</director>
</pelicula>